<?xml version="1.0" encoding="UTF-8" standalone="yes"?>
<employee xmlns:xsi="http://www.w3.org/2001/XMLSchema-instance"
          xmlns="http:\\localhost\8080\Tracker-war\xsl\xsd"
          xsi:schemaLocation="http:\\localhost\8080\Tracker-war\xsl\xsd TrackerXMLScheme.xsd">
    <empId>1</empId>
    <lastName>last</lastName>
    <firstName>first</firstName>
    <surName>sur</surName>
    <jobTitle>job</jobTitle>
    <login>login</login>
    <pass>pass</pass>
    <department>
        <deptId>1</deptId>
        <deptName>IT</deptName>
        <permission>
            <permId>1</permId>
            <permissionGroupByReadPer>
                <groupId>1</groupId>
                <groupName>Dom_admins</groupName>
            </permissionGroupByReadPer>
            <permissionGroupByWritePer>
                <groupId>1</groupId>
                <groupName>Dom_admins</groupName>
            </permissionGroupByWritePer>
        </permission>
    </department>
    <permission>
        <permId>1</permId>
        <permissionGroupByReadPer>
            <groupId>1</groupId>
            <groupName>Dom_admins</groupName>
        </permissionGroupByReadPer>
        <permissionGroupByWritePer>
            <groupId>1</groupId>
            <groupName>Dom_admins</groupName>
        </permissionGroupByWritePer>
    </permission>
    <role>
        <roleId>1</roleId>
        <roleName>mgr1</roleName>
    </role>
</employee>
